{
  "approval_id": "APR-G1-PRODUCT", "change_id": "CHG-EXAMPLE-001", "gate": "G1_PROPOSAL",
  "decision": "approved", "actor_id": "example-product-owner", "actor_role": "product_owner",
  "decided_at": "2026-07-12T10:05:00+08:00", "evidence_ids": ["EVD-PROPOSAL-REVIEW"],
  "identity_provider": "example-oidc", "identity_claim": null, "commit_sha": null
}
